{
  "$schema": "../../../schemas/algorithm-spec.schema.json",
  "metadata": {
    "id": "ecg.sloperange",
    "module": "ecg"
  },
  "informative": {
    "title": "Slope-range ECG-derived respiration",
    "summary": "Estimates an ECG-derived respiration amplitude series from derivative ECG morphology around detected R waves.",
    "description": "The slope-range method summarizes beat-to-beat respiratory modulation by comparing the maximum upslope and minimum downslope of a derivative ECG signal in short windows around each R wave.",
    "notes": [
      "The signal-aligned slope vectors and selected extrema positions support visual inspection of the analysis performed around each R wave."
    ],
    "keywords": [
      "ECG",
      "ECG-derived respiration",
      "EDR",
      "slope range",
      "respiratory modulation"
    ]
  },
  "provenance": {
    "references": [
      {
        "id": "kontaxis_edr_af_2020",
        "relation": "original_method",
        "note": "Primary method and provenance reference for slope-range ECG-derived respiration."
      },
      {
        "id": "varon_comparative_edr_2020",
        "relation": "validation",
        "note": "Comparative EDR context and validation evidence for single-lead ambulatory ECG."
      }
    ]
  },
  "normative": {
    "inputs": [
      {
        "id": "decg",
        "data_type": "real_vector",
        "shape": "vector",
        "unit": "a.u.",
        "allow_nan": false,
        "allow_inf": false,
        "constraints": {
          "minimum_length": 2
        }
      },
      {
        "id": "r_wave_times",
        "data_type": "real_vector",
        "shape": "vector",
        "unit": "s",
        "allow_nan": false,
        "allow_inf": false,
        "constraints": {
          "minimum_length": 1
        }
      },
      {
        "id": "sampling_frequency",
        "data_type": "real_scalar",
        "shape": "scalar",
        "unit": "Hz",
        "allow_nan": false,
        "allow_inf": false,
        "constraints": {
          "exclusive_minimum": 0
        }
      }
    ],
    "parameters": [],
    "outputs": [
      {
        "id": "edr",
        "data_type": "real_vector",
        "shape": "vector",
        "unit": "a.u."
      },
      {
        "id": "upslopes",
        "data_type": "real_vector",
        "shape": "vector",
        "unit": "a.u."
      },
      {
        "id": "downslopes",
        "data_type": "real_vector",
        "shape": "vector",
        "unit": "a.u."
      },
      {
        "id": "upslope_max_positions",
        "data_type": "real_vector",
        "shape": "vector",
        "unit": "sample"
      },
      {
        "id": "downslope_min_positions",
        "data_type": "real_vector",
        "shape": "vector",
        "unit": "sample"
      }
    ],
    "definitions": [
      {
        "target": "r_wave_times",
        "text": "ECG R-wave occurrence times in seconds. Values must be finite, one-dimensional, strictly increasing, without repeats, and mappable onto the derivative ECG sample grid using sampling_frequency."
      },
      {
        "target": "r_wave_samples",
        "text": "Conceptual zero-based sample-grid positions computed as round(r_wave_times * sampling_frequency) on the derivative ECG sample grid. Each value must lie from 0 through length(decg) - 1, inclusive. Public implementations may retain native array indices in their direct APIs, but conformance values for normative position outputs must use this zero-based grid."
      },
      {
        "target": "analysis_windows",
        "text": "Set short_window = round(sampling_frequency * 0.015) and long_window = round(sampling_frequency * 0.05). The upslope_window contains integer offsets greater than -long_window and less than or equal to short_window. The downslope_window contains integer offsets greater than or equal to -short_window and less than long_window."
      },
      {
        "target": "complete_beat",
        "text": "A beat is complete only when both its upslope and downslope analysis windows lie entirely within the decg sample grid. Only complete beats contribute samples to upslopes or downslopes."
      },
      {
        "target": "extrema_selection",
        "text": "For each complete beat, select the maximum decg value in the upslope window and the minimum decg value in the downslope window. If multiple samples share the selected extreme value, choose the earliest sample in the corresponding window."
      },
      {
        "target": "edr",
        "text": "For each complete beat, compute edr as the decg value at upslope_max_positions minus the decg value at downslope_min_positions. Align edr with r_wave_times."
      },
      {
        "target": "upslopes",
        "text": "Return a vector with the same length, zero-based sample grid, and unit as decg. Copy decg inside the union of complete-beat upslope windows and set every other sample to NaN."
      },
      {
        "target": "downslopes",
        "text": "Return a vector with the same length, zero-based sample grid, and unit as decg. Copy decg inside the union of complete-beat downslope windows and set every other sample to NaN."
      },
      {
        "target": "upslope_max_positions",
        "text": "Return the selected upslope maximum positions on the conceptual zero-based decg sample grid, aligned with r_wave_times. Set the position to NaN for an incomplete beat."
      },
      {
        "target": "downslope_min_positions",
        "text": "Return the selected downslope minimum positions on the conceptual zero-based decg sample grid, aligned with r_wave_times. Set the position to NaN for an incomplete beat."
      },
      {
        "target": "boundary_outputs",
        "text": "For an incomplete beat, preserve alignment with r_wave_times and set the corresponding edr, upslope_max_positions, and downslope_min_positions values to NaN. Do not copy either incomplete beat window into upslopes or downslopes."
      }
    ],
    "behavior": {
      "nan_handling": "NaN and infinite values in decg, r_wave_times, or sampling_frequency are invalid inputs. NaN values mark incomplete beats in edr, upslope_max_positions, and downslope_min_positions, and samples outside complete-beat analysis windows in upslopes and downslopes.",
      "empty_input": "Empty decg and empty r_wave_times inputs are invalid.",
      "input_orientation": "Treat decg and r_wave_times as one-dimensional vectors regardless of row or column orientation. The edr, upslope_max_positions, and downslope_min_positions outputs are one-dimensional ordered vectors aligned with r_wave_times. The upslopes and downslopes outputs are one-dimensional ordered vectors aligned with decg.",
      "insufficient_data": "If decg is too short to support both complete windows around a beat, the aligned edr and extrema-position values are NaN and that beat contributes no samples to either signal-aligned slope vector when the corresponding r_wave_samples value is inside the signal. R-wave times that map outside the derivative ECG sample grid are invalid."
    }
  }
}
