{
  "$schema": "../../../schemas/algorithm-spec.schema.json",
  "metadata": {
    "id": "ecg.pantompkins",
    "module": "ecg"
  },
  "informative": {
    "title": "Pan-Tompkins-style ECG R-wave detection",
    "summary": "Detects ordered R-wave occurrence times from a sampled ECG signal and exposes intermediate processing signals for plotting and debugging.",
    "description": "This Pan-Tompkins-style detector is implemented in Biosigmat using bandpass filtering, derivative filtering, squaring, moving-window integration, peak detection, and peak refinement. The current implementation follows the Pan-Tompkins processing style but is not a byte-for-byte reproduction of the original paper.",
    "notes": [
      "The primary detection target is the ECG R wave.",
      "Intermediate outputs are part of the public contract because they are used for plotting and debugging detections.",
      "Exact cross-language numerical equality of intermediate signals is not required by the first positive conformance case.",
      "ECG signals shorter than 3 seconds are insufficient data."
    ],
    "keywords": [
      "ECG",
      "Pan-Tompkins",
      "QRS detection",
      "R waves",
      "debugging",
      "intermediate signals"
    ]
  },
  "provenance": {
    "references": [
      {
        "id": "pan_tompkins_1985",
        "relation": "original_method",
        "note": "Algorithm origin for the Pan-Tompkins-style processing chain."
      }
    ]
  },
  "normative": {
    "inputs": [
      {
        "id": "ecg",
        "data_type": "real_vector",
        "shape": "vector",
        "unit": "a.u.",
        "allow_nan": true,
        "allow_inf": false
      },
      {
        "id": "sampling_frequency",
        "data_type": "real_scalar",
        "shape": "scalar",
        "unit": "Hz",
        "allow_nan": false,
        "allow_inf": false,
        "constraints": {
          "exclusive_minimum": 0
        }
      }
    ],
    "parameters": [
      {
        "id": "bandpass_frequency",
        "data_type": "real_vector",
        "default": [
          5,
          12
        ],
        "unit": "Hz",
        "constraints": {
          "minimum_length": 2
        }
      },
      {
        "id": "integration_window_size",
        "data_type": "real_scalar",
        "default": 0.15,
        "unit": "s",
        "constraints": {
          "exclusive_minimum": 0
        }
      },
      {
        "id": "minimum_peak_distance",
        "data_type": "real_scalar",
        "default": 0.5,
        "unit": "s",
        "constraints": {
          "exclusive_minimum": 0
        }
      },
      {
        "id": "snap_to_peak_window_size",
        "data_type": "real_scalar",
        "default": 20,
        "unit": "sample",
        "constraints": {
          "exclusive_minimum": 0
        }
      }
    ],
    "outputs": [
      {
        "id": "r_wave_times",
        "data_type": "real_vector",
        "shape": "vector",
        "unit": "s"
      },
      {
        "id": "ecg_filtered",
        "data_type": "real_vector",
        "shape": "vector",
        "unit": "a.u."
      },
      {
        "id": "decg_squared",
        "data_type": "real_vector",
        "shape": "vector",
        "unit": "a.u.^2"
      },
      {
        "id": "decg_envelope",
        "data_type": "real_vector",
        "shape": "vector",
        "unit": "a.u.^2"
      }
    ],
    "definitions": [
      {
        "target": "finite_ecg_segment",
        "text": "A finite ECG segment is a maximal contiguous run of ecg samples that are neither NaN nor infinite. NaN samples are hard boundaries between finite ECG segments; Inf and -Inf samples are invalid inputs."
      },
      {
        "target": "detection_chain",
        "text": "Within each finite ECG segment, apply bandpass filtering, derivative filtering, squaring, moving-window integration, peak detection, and peak refinement without using samples across a NaN boundary."
      },
      {
        "target": "r_wave_times",
        "text": "Detected ECG R-wave occurrence times in seconds, sorted in ascending order."
      },
      {
        "target": "ecg_filtered",
        "text": "Bandpass-filtered ECG signal, represented as a one-dimensional vector with the same canonical sample order and length as the input ECG."
      },
      {
        "target": "decg_squared",
        "text": "Squared derivative-filtered ECG signal, represented as a one-dimensional vector with the same canonical sample order and length as the input ECG."
      },
      {
        "target": "decg_envelope",
        "text": "Squared and moving-window integrated detection envelope, represented as a one-dimensional vector with the same canonical sample order and length as the input ECG."
      }
    ],
    "behavior": {
      "nan_handling": "NaN samples in ecg are allowed and act as hard boundaries between finite ECG segments. Filtering, integration, peak detection, and peak refinement must not use samples across a NaN boundary. No R-wave detection is returned inside a NaN gap. Intermediate vector outputs remain aligned sample-by-sample with ecg and represent unprocessed NaN gaps as NaN.",
      "empty_input": "Empty ECG input is invalid; the exact failure mechanism is implementation-specific.",
      "input_orientation": "Treat ECG input as a one-dimensional vector regardless of row or column orientation. All vector outputs are conceptually one-dimensional ordered vectors.",
      "insufficient_data": "An ECG signal with duration less than 3 seconds is insufficient data. Signal duration is defined as length(ecg) / sampling_frequency. A duration of exactly 3 seconds is sufficient."
    }
  }
}
