{
  "$schema": "../../../schemas/algorithm-spec.schema.json",
  "metadata": {
    "id": "tools.nan_filter",
    "module": "tools"
  },
  "informative": {
    "title": "Causal filtering with NaN-aware gap handling",
    "summary": "Applies ordinary causal filtering while interpolating short NaN gaps and preserving long NaN gaps.",
    "description": "This tool defines NaN-aware causal filtering for one-dimensional signals. It is intended for filtering sampled signals that may contain missing runs marked by NaN values.",
    "notes": [
      "MATLAB mapping: nanfilter(b, a, x, maxgap).",
      "Canonical Biosigpy mapping should use tools.nan_filter with numerator_coefficients, denominator_coefficients, signal, and max_gap.",
      "Matrix and higher-dimensional inputs are outside this draft because the current Biosiglib schema has scalar and vector shapes only.",
      "With no NaN samples, the output is equivalent to ordinary causal filter(b, a, signal).",
      "Short gaps are linearly interpolated before filtering and are not restored to NaN.",
      "Long gaps split the signal into independently filtered segments and are restored to NaN in the output."
    ],
    "keywords": [
      "NaN",
      "missing data",
      "causal filter",
      "gap interpolation",
      "segmentation"
    ]
  },
  "provenance": {
    "references": []
  },
  "normative": {
    "inputs": [
      {
        "id": "numerator_coefficients",
        "data_type": "real_vector",
        "shape": "vector",
        "unit": "1",
        "allow_nan": false,
        "allow_inf": false,
        "constraints": {
          "minimum_length": 1
        }
      },
      {
        "id": "denominator_coefficients",
        "data_type": "real_vector",
        "shape": "vector",
        "unit": "1",
        "allow_nan": false,
        "allow_inf": false,
        "constraints": {
          "minimum_length": 1
        }
      },
      {
        "id": "signal",
        "data_type": "real_vector",
        "shape": "vector",
        "unit": "a.u.",
        "allow_nan": true,
        "allow_inf": false
      }
    ],
    "parameters": [
      {
        "id": "max_gap",
        "data_type": "integer_scalar",
        "default": 0,
        "unit": "sample",
        "constraints": {
          "minimum": 0
        }
      }
    ],
    "outputs": [
      {
        "id": "filtered_signal",
        "data_type": "real_vector",
        "shape": "vector",
        "unit": "a.u."
      }
    ],
    "definitions": [
      {
        "target": "short_nan_gap",
        "text": "A contiguous run of NaN samples whose length is less than or equal to max_gap."
      },
      {
        "target": "long_nan_gap",
        "text": "A contiguous run of NaN samples whose length is greater than max_gap."
      },
      {
        "target": "short_gap_interpolation",
        "text": "Short NaN gaps inside a valid segment are filled by linear interpolation before causal filtering."
      },
      {
        "target": "segment_filtering",
        "text": "If long NaN gaps are present, filter each non-long-gap segment independently with ordinary causal filter semantics after short-gap interpolation."
      },
      {
        "target": "segment_too_short",
        "text": "If a segment length is shorter than max(length(denominator_coefficients), length(numerator_coefficients)), return the linearly filled segment without applying the filter."
      },
      {
        "target": "filtered_signal",
        "text": "filtered_signal is aligned sample-by-sample with signal; long NaN gaps are restored to NaN and short NaN gaps are represented by filtered interpolated values."
      }
    ],
    "behavior": {
      "nan_handling": "NaN samples in signal are classified into short and long gaps using max_gap. Short gaps are linearly interpolated and filtered. Long gaps are restored as NaN after independent segment processing. All-NaN signal input returns all NaN with the same shape.",
      "empty_input": "Empty signal input returns an empty filtered_signal.",
      "input_orientation": "Row and column vectors represent the same canonical signal sequence. filtered_signal is a one-dimensional ordered vector aligned with signal.",
      "insufficient_data": "Segments shorter than max(length(denominator_coefficients), length(numerator_coefficients)) are returned after interpolation rather than filtered."
    }
  }
}
