{
  "$schema": "../../../schemas/algorithm-spec.schema.json",
  "metadata": {
    "id": "hrv.removefp",
    "module": "hrv"
  },
  "informative": {
    "title": "False-positive event removal",
    "summary": "Removes detections that follow abnormally short event-to-event intervals using a fixed adaptive-baseline rule.",
    "description": "The method is a deterministic preprocessing operation for event-time series. It identifies intervals that are short relative to a local median-filtered baseline and removes the second event of every flagged pair in one simultaneous pass.",
    "notes": [
      "Input event times must already be strictly increasing; implementations must not sort them implicitly.",
      "The recommended HRV preprocessing sequence applies false-positive removal before missing-event gap filling.",
      "The median-filter settings and the 0.7 multiplier are empirical algorithm constants inherited from Biosigmat, not clinically validated thresholds.",
      "Timestamp-only processing cannot always distinguish a false detection from a nearby true event; the contract preserves the deterministic historical selection rule."
    ],
    "keywords": [
      "event times",
      "false positives",
      "HRV preprocessing",
      "adaptive baseline"
    ]
  },
  "provenance": {
    "references": []
  },
  "normative": {
    "inputs": [
      {
        "id": "tk",
        "data_type": "real_vector",
        "shape": "vector",
        "unit": "s",
        "allow_nan": false,
        "allow_inf": false,
        "constraints": {
          "minimum_length": 1
        }
      }
    ],
    "parameters": [],
    "outputs": [
      {
        "id": "tn",
        "data_type": "real_vector",
        "shape": "vector",
        "unit": "s"
      }
    ],
    "definitions": [
      {
        "target": "tk",
        "text": "tk is a non-empty ordered vector of finite event timestamps expressed in seconds. The time origin is unrestricted, so negative timestamps are valid."
      },
      {
        "target": "event_order",
        "text": "Event timestamps must be strictly increasing: every timestamp must be greater than the preceding timestamp. Unsorted timestamps and duplicate timestamps are invalid, and implementations must not sort tk implicitly."
      },
      {
        "target": "original_intervals",
        "text": "For an input containing at least three events, compute dtk as every successive difference of the original tk sequence before any removal."
      },
      {
        "target": "adaptive_baseline",
        "text": "Compute the adaptive baseline by applying tools.medfilt_threshold to the original dtk sequence with window = 30 samples, factor = 1, and max_threshold = 1.5 s."
      },
      {
        "target": "false_positive_interval",
        "text": "Flag an original interval only when dtk is strictly less than 0.7 times its aligned adaptive baseline. An interval equal to 0.7 times the baseline is retained."
      },
      {
        "target": "tn",
        "text": "Retain the first input event. For every flagged original interval, remove the second event of that interval; retain every other input event without modifying its timestamp."
      },
      {
        "target": "single_pass_removal",
        "text": "Compute the baseline and all interval flags on the complete original event series, then apply all removals simultaneously in one pass. Do not recompute the baseline or iterate after removal."
      },
      {
        "target": "adjacent_false_positive_intervals",
        "text": "When flagged intervals are adjacent, remove the second event of every flagged interval. This can remove multiple consecutive events while always retaining the first event of the first flagged pair."
      },
      {
        "target": "empirical_algorithm_constants",
        "text": "The baseline window of 30 samples, baseline factor of 1, 1.5 s baseline cap, and 0.7 false-positive multiplier are fixed empirical algorithm constants. They are not population-independent or clinically validated thresholds."
      }
    ],
    "behavior": {
      "nan_handling": "NaN, Inf, and -Inf timestamps are invalid. NaN does not represent a missing event in tk; a missed event is represented by the resulting abnormally long finite interval.",
      "empty_input": "Empty tk input is invalid.",
      "input_orientation": "Row and column vectors represent the same canonical event-time sequence. Output orientation is implementation-specific and is not part of the language-independent contract.",
      "insufficient_data": "One- and two-event inputs are valid and are returned unchanged because there is insufficient interval context for false-positive detection."
    }
  }
}
