{
  "$schema": "../../../schemas/algorithm-spec.schema.json",
  "metadata": {
    "id": "ecg.baselineremove",
    "module": "ecg"
  },
  "informative": {
    "title": "ECG baseline removal from fiducial isoelectric samples",
    "summary": "Estimates a slowly varying ECG baseline from local means around fiducial positions and subtracts its spline interpolation.",
    "description": "The method samples an isoelectric ECG level around supplied fiducial positions, interpolates those levels across the complete signal, and returns both the detrended ECG and estimated baseline.",
    "notes": [
      "Using PR-segment fiducials and cubic-spline interpolation is literature-backed; offset, local-window, boundary, and fallback details are empirical Biosigmat compatibility choices.",
      "The canonical sample-position grid is one-based even when a public implementation exposes native zero-based indices."
    ],
    "keywords": [
      "ECG",
      "baseline wander",
      "isoelectric level",
      "fiducial positions",
      "spline interpolation"
    ]
  },
  "provenance": {
    "references": [
      {
        "id": "meyer_keiser_ecg_baseline_spline_1977",
        "relation": "original_method",
        "note": "Supports estimating ECG baseline noise from PR-segment samples and interpolating those estimates with cubic splines; the exact compatibility rules in this specification are not attributed to the paper."
      }
    ]
  },
  "normative": {
    "inputs": [
      {
        "id": "ecg",
        "data_type": "real_vector",
        "shape": "vector",
        "unit": "a.u.",
        "allow_nan": false,
        "allow_inf": false,
        "constraints": {
          "minimum_length": 1
        }
      },
      {
        "id": "fiducial_positions",
        "data_type": "real_vector",
        "shape": "vector",
        "unit": "sample",
        "allow_nan": false,
        "allow_inf": false,
        "constraints": {
          "exclusive_minimum": 0,
          "minimum_length": 1
        }
      },
      {
        "id": "offset",
        "data_type": "integer_scalar",
        "shape": "scalar",
        "unit": "sample",
        "allow_nan": false,
        "allow_inf": false,
        "constraints": {
          "minimum": 0
        }
      }
    ],
    "parameters": [
      {
        "id": "window_size",
        "data_type": "integer_scalar",
        "default": 5,
        "unit": "sample",
        "constraints": {
          "exclusive_minimum": 0
        }
      }
    ],
    "outputs": [
      {
        "id": "ecg_detrended",
        "data_type": "real_vector",
        "shape": "vector",
        "unit": "a.u."
      },
      {
        "id": "baseline",
        "data_type": "real_vector",
        "shape": "vector",
        "unit": "a.u."
      }
    ],
    "definitions": [
      {
        "target": "canonical_sample_grid",
        "text": "Interpret ecg on the one-based integer sample grid 1 through N, where N = length(ecg). Public APIs may accept native indices only if they convert them to this grid before applying the remaining rules."
      },
      {
        "target": "adjusted_positions",
        "text": "Subtract offset from every fiducial_positions value, then round each result to the nearest integer with exact half-way values rounded away from zero. Sort the rounded results, remove duplicates, and discard values outside the inclusive canonical range 1 through N, in that order. The remaining values are the valid fiducial positions."
      },
      {
        "target": "fiducial_ordering",
        "text": "Raw fiducial_positions may be unordered, repeated, and fractional. Their order and multiplicity do not affect the result after adjusted-position sorting and deduplication."
      },
      {
        "target": "local_window",
        "text": "Set radius = floor(window_size / 2). For each valid fiducial position p, use every ECG sample from max(1, p - radius) through min(N, p + radius), inclusive. The nominal span is therefore 2 * radius + 1: an odd window_size uses exactly window_size samples away from boundaries, while an even window_size uses window_size + 1 samples. Truncate the span at signal boundaries without padding."
      },
      {
        "target": "fiducial_levels",
        "text": "At each valid fiducial position, compute the arithmetic mean of all ECG samples in its local_window. Pair the resulting finite level with that valid one-based position."
      },
      {
        "target": "spline_interpolation",
        "text": "Interpolate the fiducial levels over every integer position 1 through N using the same polynomial piecewise model as MATLAB spline with same-size position and value vectors: two valid positions define a linear polynomial, three define a quadratic polynomial, and four or more define a cubic not-a-knot spline. Evaluate outside the first and last valid positions by polynomial extrapolation from the corresponding end piece."
      },
      {
        "target": "baseline",
        "text": "Return the interpolated or extrapolated fiducial-level model evaluated at every canonical ECG sample position. baseline has length N and is aligned with ecg."
      },
      {
        "target": "ecg_detrended",
        "text": "Return ecg - baseline element by element. ecg_detrended has length N and is aligned with ecg."
      },
      {
        "target": "comparison",
        "text": "Each conformance output defines an absolute tolerance and uses zero relative tolerance. Absence of expected_warnings means that no warning is expected."
      },
      {
        "target": "error_categories",
        "text": "Use invalid_type for non-real or non-numeric inputs, invalid_shape for non-vector ECG or fiducial inputs and non-scalar offset or window_size, invalid_value for empty or nonfinite vectors, nonpositive raw fiducial positions, negative or non-integer offset, or nonpositive or non-integer window_size, and insufficient_data when exactly one valid fiducial position remains. Language-specific exception and warning classes and message text are not normative."
      }
    ],
    "warnings": [
      {
        "id": "no_valid_fiducial_positions",
        "condition": "No fiducial position remains after offset subtraction, half-away-from-zero rounding, sorting, deduplication, and range filtering.",
        "effect": "Return ecg unchanged as ecg_detrended and an all-zero baseline of the same length.",
        "aggregation": "Emit exactly once per call and identify fiducial_positions as the complete affected-id set."
      }
    ],
    "behavior": {
      "nan_handling": "NaN, positive infinity, negative infinity, and complex values in ecg or fiducial_positions are invalid. Successful outputs are finite for finite inputs.",
      "empty_input": "Empty ecg and empty fiducial_positions inputs are invalid.",
      "input_orientation": "Treat ecg and fiducial_positions as one-dimensional vectors regardless of MATLAB row or column orientation. Both outputs are one-dimensional ordered vectors aligned with ecg; a language may preserve the ECG vector orientation in its direct API.",
      "insufficient_data": "If no valid fiducial position remains, emit no_valid_fiducial_positions and return the defined identity result. If exactly one valid position remains, raise insufficient_data because a spline baseline cannot be defined. Two or more valid positions are sufficient."
    }
  }
}
